{
  "session_key": "claude_code:7f1e2d3c-4b5a-4c6d-8e7f-0a1b2c3d4e5f",
  "agent_kind": "claude_code",
  "agent_label": "Claude Code",
  "project": {
    "project_key": "c:/dev/agentnest",
    "name": "agentnest",
    "path_hint": "…\\dev\\agentnest",
    "repo": "owner/agentnest",
    "branch": "feat/pairing"
  },
  "state": "testing",
  "state_since": "2026-10-15T12:34:50.000Z",
  "headline": "테스트를 돌리고 있어요 (cargo test -p core)",
  "detail": "Run core tests.",
  "started_at": "2026-10-15T11:02:10.000Z",
  "turn": {
    "active": true,
    "started_at": "2026-10-15T12:30:01.000Z",
    "prompt_preview": "페어링 토큰 만료 테스트 추가해줘"
  },
  "permission_mode": "default",
  "remote_approval": "available",
  "pending_approval_ids": [],
  "counters": {
    "tools": 42,
    "files_modified": 3,
    "commands": 7,
    "tests": 2,
    "errors": 1
  },
  "recent_files": [
    {
      "path_hint": "…\\src\\pairing.rs",
      "op": "update",
      "at": "2026-10-15T12:34:40.000Z"
    }
  ],
  "recent_commands": [
    {
      "command_preview": "cargo test -p agentnest-core",
      "command_class": "test",
      "at": "2026-10-15T12:34:50.000Z"
    }
  ],
  "last_test": {
    "status": "running",
    "command_class": "test",
    "at": "2026-10-15T12:34:50.000Z"
  },
  "meta": {
    "title": "훅 수집기 구현",
    "model": "claude-opus-5",
    "cost_usd": 1.23,
    "context_used_pct": 41,
    "review": {
      "p0": 0,
      "p1": 2,
      "state": "completed"
    }
  },
  "last_event_seq": 1842,
  "last_event_at": "2026-10-15T12:34:55.000Z",
  "ended": false,
  "stale": false
}
